{
    "schemaVersion": 1,
    "configVersion": 163,
    "generatedAt": 1790064863824,
    "expiresAt": 1821600863824,
    "minimumAppVersion": 4,
    "recommendedAppVersion": 1,
    "forceUpdate": true,
    "maintenanceMode": false,
    "providers": [
        {
            "id": "kamababa1",
            "name": "KamaBaba",
            "enabled": true,
            "baseUrl": "https://www.mykamababa.com",
            "adapter": "html_selector",
            "capabilities": [
                "HOME",
                "CATEGORY",
                "SEARCH",
                "DETAILS",
                "STREAM",
                "DOWNLOAD"
            ],
            "description": "",
            "navigation": {
                "home": "/?filter=latest",
                "search": "/?s={query}",
                "page": "/page/{page}/?filter=latest"
            },
            "selectors": {
                "item": "article.thumb-block, article.video-preview-item, article",
                "title": "a[title], h2.entry-title a, h2 a",
                "thumbnail": "img.video-main-thumb, img",
                "thumbnailAttr": "src",
                "detailUrl": "a.video-preview-link, a[href*='kamababa'], a",
                "duration": ".duration",
                "detailTitle": "h1",
                "detailDescription": ".entry-content p, .video-details, p",
                "detailThumbnail": "meta[property='og:image'], img.video-main-thumb",
                "player": "iframe[src*='player']",
                "videoSource": "meta[itemprop='contentURL'], video source[src], video[src], source[type='video/mp4']",
                "videoSourceAttr": "src",
                "relatedItems": ".related-videos article, .related article"
            },
            "contentPolicy": {
                "rightsStatus": "Public Aggregation Index",
                "disclaimer": "Aggregated public reference media feed."
            },
            "domains": [
                "https://www.mykamababa.com",
                "https://mykamababa.com",
                "https://www.kamababa1.com",
                "https://kamababa1.com"
            ],
            "familyId": "clean_tube_family",
            "validationMarker": "kamababa"
        },
        {
            "id": "masa49",
            "name": "Masa49",
            "enabled": true,
            "baseUrl": "https://www.masa49.nl",
            "adapter": "html_selector",
            "capabilities": [
                "HOME",
                "CATEGORY",
                "SEARCH",
                "DETAILS",
                "STREAM",
                "DOWNLOAD"
            ],
            "description": "",
            "navigation": {
                "home": "/",
                "search": "/?s={query}",
                "page": "/page/{page}/"
            },
            "selectors": {
                "item": "div.video-block, .video-block, article",
                "title": "span.title, a.infos, a[title], h2",
                "thumbnail": "img.video-img, img",
                "thumbnailAttr": "data-src",
                "detailUrl": "a.thumb, a.infos, a",
                "duration": ".duration, .badge-duration",
                "detailTitle": "h1",
                "detailDescription": ".video-description, .desc, .entry-content p",
                "detailThumbnail": "video[poster], meta[property='og:image'], img.video-img, img",
                "player": "video, iframe",
                "videoSource": "video source[src], source[type='video/mp4'], video[src]",
                "videoSourceAttr": "src",
                "relatedItems": "div.video-block, .video-block"
            },
            "contentPolicy": {
                "rightsStatus": "Public Aggregation Index",
                "disclaimer": "Aggregated public reference feed."
            },
            "domains": [
                "https://www.masa49.nl",
                "https://masa49.nl"
            ],
            "familyId": "masa_network_family",
            "validationMarker": "masa"
        },
        {
            "id": "fsiblogxx",
            "name": "FSIBlog",
            "enabled": true,
            "baseUrl": "https://www.fsiblogxx.com",
            "adapter": "html_selector",
            "capabilities": [
                "HOME",
                "CATEGORY",
                "SEARCH",
                "DETAILS",
                "STREAM"
            ],
            "description": "",
            "navigation": {
                "home": "/",
                "search": "/?s={query}",
                "page": "/page/{page}/"
            },
            "selectors": {
                "item": "article.type-porn-video, article.porn-video, div.porn-video, article",
                "title": "h2.entry-title a, h2 a, a.entry-title, a",
                "thumbnail": "img.attachment-medium, img",
                "thumbnailAttr": "data-src",
                "detailUrl": "h2.entry-title a, h2 a, a",
                "duration": ".duration, .time",
                "detailTitle": "h1.entry-title, h1",
                "detailDescription": ".entry-content p, .post-content",
                "detailThumbnail": "meta[property='og:image'], img",
                "player": "iframe[src*='player'], video",
                "videoSource": "video source[src], video[src]",
                "videoSourceAttr": "src",
                "relatedItems": ".related-videos article, .related article"
            },
            "contentPolicy": {
                "rightsStatus": "Public Web Index",
                "disclaimer": "Aggregated public media feed."
            },
            "domains": [
                "https://www.fsiblogxx.com",
                "https://fsiblogxx.com"
            ],
            "familyId": "clean_tube_family",
            "validationMarker": "fsiblog"
        },
        {
            "id": "masahub2",
            "name": "MasaHub2",
            "enabled": true,
            "baseUrl": "https://masahub2.com",
            "adapter": "html_selector",
            "capabilities": [
                "HOME",
                "CATEGORY",
                "SEARCH",
                "DETAILS",
                "STREAM"
            ],
            "description": "",
            "navigation": {
                "home": "/",
                "search": "/?s={query}",
                "page": "/page/{page}/"
            },
            "selectors": {
                "item": "article.vcard, article, div.item",
                "title": "h3.vtitle, .vtitle, h2 a, a.vtitle, h2",
                "thumbnail": ".thumb, img",
                "thumbnailAttr": "style",
                "detailUrl": "a",
                "duration": "span.dur, .badge-duration",
                "detailTitle": "h1",
                "detailDescription": ".entry-content p, .video-details",
                "detailThumbnail": "video[poster], meta[property='og:image'], img",
                "player": "video, iframe",
                "videoSource": "video source[src], source[type='video/mp4'], video[src]",
                "videoSourceAttr": "src",
                "relatedItems": ".related-videos article, .related article"
            },
            "contentPolicy": {
                "rightsStatus": "Public Web Index",
                "disclaimer": "Aggregated public media feed."
            },
            "domains": [
                "https://masahub2.com"
            ],
            "familyId": "masa_network_family",
            "validationMarker": "masahub"
        },
        {
            "id": "aagmaal",
            "name": "AagMaal",
            "enabled": true,
            "baseUrl": "https://aagmaal.date",
            "adapter": "html_selector",
            "capabilities": [
                "HOME",
                "CATEGORY",
                "SEARCH",
                "DETAILS",
                "STREAM",
                "DOWNLOAD"
            ],
            "description": "",
            "navigation": {
                "home": "/?filter=latest",
                "search": "/?s={query}",
                "page": "/page/{page}/?filter=latest",
                "categories": "/categories/"
            },
            "selectors": {
                "item": "article.thumb-block, article.loop-video, article.post, article",
                "title": "header.entry-header a, h2.entry-title a, h2 a, a[title], .cat-title",
                "thumbnail": "img",
                "thumbnailAttr": "src",
                "detailUrl": "header.entry-header a, a.thumb-pop, h2.entry-title a, a[title], a",
                "duration": ".duration, span.hd, .thumb-block span",
                "detailTitle": "h1.entry-title, h1",
                "detailDescription": ".entry-content p, .video-details",
                "detailThumbnail": "meta[property='og:image'], img",
                "player": "iframe[src*='tube279'], iframe[src*='streamtape'], iframe[src*='lulu'], iframe[src*='/e/'], a[href*='tube279'], video",
                "videoSource": "video source[src], video[src], source[type='video/mp4']",
                "videoSourceAttr": "src",
                "relatedItems": ".related-posts article, .related article, .videos-list article"
            },
            "contentPolicy": {
                "rightsStatus": "Public Web Index",
                "disclaimer": "Aggregated public media feed."
            },
            "domains": [
                "https://aagmaal.date",
                "https://aagmaal.run"
            ],
            "familyId": "aagmaal_date_family",
            "validationMarker": "aagmaal"
        },
        {
            "id": "fry99",
            "name": "Fry99",
            "enabled": true,
            "baseUrl": "https://fry99.cc",
            "adapter": "html_selector",
            "capabilities": [
                "HOME",
                "CATEGORY",
                "SEARCH",
                "DETAILS",
                "STREAM",
                "DOWNLOAD"
            ],
            "description": "",